{
  "$schema": "http://json-schema.org/draft-07/schema#",
  "title": "Space Trader save v2",
  "type": "object",
  "additionalProperties": false,
  "required": [
    "saveVersion",
    "player",
    "progress",
    "inventory",
    "currency",
    "settings",
    "achievements",
    "world"
  ],
  "properties": {
    "saveVersion": {
      "const": "2"
    },
    "player": {
      "type": "object",
      "additionalProperties": false,
      "required": ["id", "name"],
      "properties": {
        "id": {
          "type": "string",
          "minLength": 1
        },
        "name": {
          "type": "string",
          "minLength": 1
        }
      }
    },
    "progress": {
      "type": "object",
      "additionalProperties": false,
      "required": ["level", "xp"],
      "properties": {
        "level": {
          "type": "integer",
          "minimum": 1
        },
        "xp": {
          "type": "integer",
          "minimum": 0
        }
      }
    },
    "inventory": {
      "$ref": "#/definitions/inventory"
    },
    "currency": {
      "$ref": "#/definitions/wallet"
    },
    "settings": {
      "$ref": "#/definitions/settings"
    },
    "achievements": {
      "type": "array",
      "items": {
        "type": "string"
      }
    },
    "world": {
      "$ref": "#/definitions/world"
    }
  },
  "definitions": {
    "inventory": {
      "type": "array",
      "items": {
        "type": "object",
        "additionalProperties": false,
        "required": ["id", "name", "quantity"],
        "properties": {
          "id": {
            "type": "string",
            "minLength": 1
          },
          "name": {
            "type": "string",
            "minLength": 1
          },
          "quantity": {
            "type": "integer",
            "minimum": 0
          }
        }
      }
    },
    "wallet": {
      "type": "object",
      "additionalProperties": false,
      "required": ["credits"],
      "properties": {
        "credits": {
          "type": "integer",
          "minimum": 0
        }
      }
    },
    "settings": {
      "type": "object",
      "additionalProperties": false,
      "required": ["difficulty", "autosave"],
      "properties": {
        "difficulty": {
          "enum": ["easy", "normal", "hard"]
        },
        "autosave": {
          "type": "boolean"
        }
      }
    },
    "world": {
      "type": "object",
      "additionalProperties": false,
      "required": ["seed", "sector"],
      "properties": {
        "seed": {
          "type": "integer"
        },
        "sector": {
          "type": "string"
        }
      }
    }
  }
}
